2118353,BasAcc 3' Braided Micro USB Charger Cable For Samsung LG Motorola Sony HTC Huawei Alcatel ZTE Android Phone Smartphone Tablet PS4 Xbox One Universal Gold,BasAcc 3' Braided Micro USB Charger Cable For Samsung LG Motorola Sony HTC Huawei Alcatel ZTE Android Phone Smartphone Tablet PS4 Xbox One Universal Gold,Default Category/Phones & Accessories/Cell Phone Accessories
2118352,BasAcc 3' Braided Micro USB Data Sync Charge Cable For Samsung Galaxy S6 Edge Plus S5 A8 A7 Core Prime Avant Ace Note 5 4 Tab Tablet Motorola Moto G E X Nexus 6 LG G4 G3 G Flex Pro 2 L80 L90 Dark Gray,BasAcc 3' Braided Micro USB Data Sync Charge Cable For Samsung Galaxy S6 Edge Plus S5 A8 A7 Core Prime Avant Ace Note 5 4 Tab Tablet Motorola Moto G E X Nexus 6 LG G4 G3 G Flex Pro 2 L80 L90 Dark Gray,Default Category/Computers & Peripherals/Computer Components/Cables
2118354,BasAcc 3' Braided Micro USB Data Sync Charging Cable for Andriod Smartphone Cell Phone Tablet Universal Silver 3FT,BasAcc 3' Braided Micro USB Data Sync Charging Cable for Andriod Smartphone Cell Phone Tablet Universal Silver 3FT,Default Category/Computers & Peripherals/Computer Components/Cables
2118349,BasAcc 3' Gold Plated High Speed HDMI Cable 1.4 Supports Ethernet 3D 4K 2160p 1080p Ultra HD HDTV PS4 Xbox Blu-Ray DVD,BasAcc 3' Gold Plated High Speed HDMI Cable 1.4 Supports Ethernet 3D 4K 2160p 1080p Ultra HD HDTV PS4 Xbox Blu-Ray DVD,Default Category/Home Audio & Theatre/Audio/Audio Components
2105796,BasAcc 3' Lightning USB Cable (Apple MFi Certified) for iPhone 6 5 5s 5c iPad Air 2 1 Mini 3rd 2nd iPod Touch 5th 6th White,BasAcc 3' Lightning USB Cable (Apple MFi Certified) for iPhone 6 5 5s 5c iPad Air 2 1 Mini 3rd 2nd iPod Touch 5th 6th White,Default Category/Home Office & Tools/Accessories & Supplies/Batteries&comma; Chargers & Accessories
2105795,BasAcc 3' Lightning USB Cable (Apple MFi Licensed & Certified) for iPhone 6 6 Plus 5 5s 5c iPad 4 Air 2 1 Mini 3rd 2nd iPod Touch 5th 6th Sync and Charge Black,BasAcc 3' Lightning USB Cable (Apple MFi Licensed & Certified) for iPhone 6 6 Plus 5 5s 5c iPad 4 Air 2 1 Mini 3rd 2nd iPod Touch 5th 6th Sync and Charge Black,Default Category/Home Office & Tools/Accessories & Supplies/Batteries, Chargers & Accessories,Default Category/Home Office & Tools/Accessories & Supplies/Batteries&comma; Chargers & Accessories
2129578,BasAcc 3' USB Type C Male to USB Type A Male Cable (USB-C to USB-A) Black,BasAcc 3' USB Type C Male to USB Type A Male Cable (USB-C to USB-A) Black,Default Category/Computers & Peripherals/Computer Components/Cables
2129577,BasAcc 3' USB Type-C Cable , USB-C Male to USB-A 3.0 Male SuperSpeed White (for New Macbook Retina 12"/ChromeBook Pixel),BasAcc 3' USB Type-C Cable , USB-C Male to USB-A 3.0 Male SuperSpeed White (for New Macbook Retina 12"/ChromeBook Pixel),Default Category/Computers & Peripherals/Computer Components/Cables
2118355,BasAcc 4' Premium Stereo 3.5mm Braided Audio Cable Male to Male Gold Plated M/M - Silver (for Speaker Soundbar Smartphone iPhone MP3 Aux Auxiliary Input) Jack to Jack 4FT,BasAcc 4' Premium Stereo 3.5mm Braided Audio Cable Male to Male Gold Plated M/M - Silver (for Speaker Soundbar Smartphone iPhone MP3 Aux Auxiliary Input) Jack to Jack 4FT,Default Category/Home Audio & Theatre/Audio/Audio Components
2102705,BasAcc 4.8A/24W Dual USB Ports Mini Rapid Universal Travel AC Wall Charger with Foldable Plug for Smartphone Tablet Cell,BasAcc 4.8A/24W Dual USB Ports Mini Rapid Universal Travel AC Wall Charger with Foldable Plug for Smartphone Tablet Cell,Default Category/Home Office & Tools/Accessories & Supplies/Batteries&comma; Chargers & Accessories
2121287,BasAcc 4-Port High Speed USB 3.0 USB Hub Splitter Expansion Desktop for PC Laptop Computer - Black,BasAcc 4-Port High Speed USB 3.0 USB Hub Splitter Expansion Desktop for PC Laptop Computer - Black,Default Category/Computers & Peripherals/Networking/Network Device
2118351,BasAcc 6' Audio TosLink Optical Digital Cable High Quality Surround Sound Audio Black/Gold 1.8M,BasAcc 6' Audio TosLink Optical Digital Cable High Quality Surround Sound Audio Black/Gold 1.8M,Default Category/Home Audio & Theatre/Audio/Audio Components
2118350,BasAcc 6' Gold Plated High Speed HDMI Cable Verion 1.4 Supports Ethernet 3D 4K 2160p 1440p 1080p Ultra HD HDTV 6ft,BasAcc 6' Gold Plated High Speed HDMI Cable Verion 1.4 Supports Ethernet 3D 4K 2160p 1440p 1080p Ultra HD HDTV 6ft,Default Category/Home Audio & Theatre/Audio/Audio Components
2129579,BasAcc 6' USB Type C Male to USB Type A Male Cable (USB-C to USB-A) White,BasAcc 6' USB Type C Male to USB Type A Male Cable (USB-C to USB-A) White,Default Category/Computers & Peripherals/Computer Components/Cables
2129580,BasAcc 6' USB Type-C Cable , USB-C Male to USB-A Male SuperSpeed 3ft Black (for New Macbook Retina 12"/ChromeBook Pixel),BasAcc 6' USB Type-C Cable , USB-C Male to USB-A Male SuperSpeed 3ft Black (for New Macbook Retina 12"/ChromeBook Pixel),Default Category/Computers & Peripherals/Computer Components/Cables
2064762,BasAcc 6.6A Aluminum 3 Port USB Car Charger Adapter for  iPhone 6 iPad Air Mini Galaxy Tab Tablet Smartphone S6 Edge S5,BasAcc 6.6A Aluminum 3 Port USB Car Charger Adapter for  iPhone 6 iPad Air Mini Galaxy Tab Tablet Smartphone S6 Edge S5,Default Category/Home Office & Tools/Accessories & Supplies/Batteries&comma; Chargers & Accessories
2101312,BasAcc 7.2 Amp 5 Port USB Car Charger with extension cable for Tablet iPad iPhone Android USB-based device (High Output),BasAcc 7.2 Amp 5 Port USB Car Charger with extension cable for Tablet iPad iPhone Android USB-based device (High Output),Default Category/Home Office & Tools/Accessories & Supplies/Batteries&comma; Chargers & Accessories
2124295,BasAcc Edge-to-Edge Full Coverage Clear Screen Protector for Apple iphone 6S 6 (Korea 3D Mask Technology),BasAcc Edge-to-Edge Full Coverage Clear Screen Protector for Apple iphone 6S 6 (Korea 3D Mask Technology),Default Category/Computers & Peripherals/Computer Accessories/Screen Privacy Covers & Protectors
2124296,BasAcc Edge-to-Edge Full Coverage Clear Screen Protector for iPhone 6 Plus / 6S Plus (Korea 3D Mask Technology),BasAcc Edge-to-Edge Full Coverage Clear Screen Protector for iPhone 6 Plus / 6S Plus (Korea 3D Mask Technology),Default Category/Computers & Peripherals/Computer Accessories/Screen Privacy Covers & Protectors
2064764,BasAcc In Car Universal Wireless FM Transmitter with Hands-Free Function & USB Car Charger for Smartphone Tablet MP3 MP4,BasAcc In Car Universal Wireless FM Transmitter with Hands-Free Function & USB Car Charger for Smartphone Tablet MP3 MP4,Default Category/Home Audio & Theatre/Audio/Audio Accessories/Bluetooth & FM Transmitters
2064765,BasAcc OTG Card Reader Support USB Flash Drive Micro SD For Samsung Galaxy S6 Edge S5 Note 4 3 Android Phone Tablet Tab,BasAcc OTG Card Reader Support USB Flash Drive Micro SD For Samsung Galaxy S6 Edge S5 Note 4 3 Android Phone Tablet Tab,Default Category/Computers & Peripherals/Computer Components/Card Readers
2140610,BasAcc SuperSpeed USB Type-C Cable Adapter (USB-C Male to HDMI Female 1080P) White,BasAcc SuperSpeed USB Type-C Cable Adapter (USB-C Male to HDMI Female 1080P) White,Default Category/Computers & Peripherals/Computer Components/Cables
2129581,BasAcc USB Type-C (Male) to USB 3.0 A (Female) Adapter Converter Cable 8" SuperSpeed,BasAcc USB Type-C (Male) to USB 3.0 A (Female) Adapter Converter Cable 8" SuperSpeed,Default Category/Computers & Peripherals/Computer Components/Cables
2140609,BasAcc USB Type-C Adapter, USB-C to DisplayPort Female SuperSpeed White (for New Macbook Retina 12"/ChromeBook Pixel),BasAcc USB Type-C Adapter, USB-C to DisplayPort Female SuperSpeed White (for New Macbook Retina 12"/ChromeBook Pixel),Default Category/Computers & Peripherals/Computer Components/Cables
2140611,BasAcc USB Type-C USB-C (Male) to VGA (Female) HD Video Converter Adapter Cable White SuperSpeed,BasAcc USB Type-C USB-C (Male) to VGA (Female) HD Video Converter Adapter Cable White SuperSpeed,Default Category/Computers & Peripherals/Computer Components/Cables
2129583,BasAcc USB-C Type C Male to RJ45 Ethernet Network LAN Adapter for new MacBook ChromeBook Pixel(Support 10/100/1000 Mbps),BasAcc USB-C Type C Male to RJ45 Ethernet Network LAN Adapter for new MacBook ChromeBook Pixel(Support 10/100/1000 Mbps),Default Category/Computers & Peripherals/Computer Components/Cables
2129582,BasAcc USB-C Type-C to 3.0 USB-A Type A Adapter Converter Connector Cable 8" (for 2015 New Macbook/ChromeBook Pixel),BasAcc USB-C Type-C to 3.0 USB-A Type A Adapter Converter Connector Cable 8" (for 2015 New Macbook/ChromeBook Pixel),Default Category/Computers & Peripherals/Computer Components/Cables
2139446,Galaxy Note 5 Case, by Insten Black PU Leather Wallet Flip Stand Case Cover w/ Card Slot For Samsung Galaxy Note 5,Galaxy Note 5 Case, by Insten Black PU Leather Wallet Flip Stand Case Cover w/ Card Slot For Samsung Galaxy Note 5,Default Category/Phones & Accessories/Cell Phone Accessories/Cell Phone Cases
2138513,Galaxy Note 5 Case, by Insten Black TPU Ultra Slim Rubber Gel Skin Case For Samsung Galaxy Note 5,Galaxy Note 5 Case, by Insten Black TPU Ultra Slim Rubber Gel Skin Case For Samsung Galaxy Note 5,Default Category/Phones & Accessories/Cell Phone Accessories/Cell Phone Cases
2138521,Galaxy Note 5 Case, by Insten Black TPU Ultra Thin Jelly Skin Rubber Gel Back Case For Samsung Galaxy Note 5,Galaxy Note 5 Case, by Insten Black TPU Ultra Thin Jelly Skin Rubber Gel Back Case For Samsung Galaxy Note 5,Default Category/Phones & Accessories/Cell Phone Accessories/Cell Phone Cases
2138518,Galaxy Note 5 Case, by Insten Blue Jelly Skin Cover Case For Samsung Galaxy Note 5,Galaxy Note 5 Case, by Insten Blue Jelly Skin Cover Case For Samsung Galaxy Note 5,Default Category/Phones & Accessories/Cell Phone Accessories/Cell Phone Cases
2139449,Galaxy Note 5 Case, by Insten Blue PU Leather Wallet Flip Stand Case Cover w/ Card Slot For Samsung Galaxy Note 5,Galaxy Note 5 Case, by Insten Blue PU Leather Wallet Flip Stand Case Cover w/ Card Slot For Samsung Galaxy Note 5,Default Category/Phones & Accessories/Cell Phone Accessories/Cell Phone Cases
2138510,Galaxy Note 5 Case, by Insten Blue TPU Rubber Gel Case For Samsung Galaxy Note 5,Galaxy Note 5 Case, by Insten Blue TPU Rubber Gel Case For Samsung Galaxy Note 5,Default Category/Phones & Accessories/Cell Phone Accessories/Cell Phone Cases
2138514,Galaxy Note 5 Case, by Insten Clear TPU Ultra Thin Jelly Skin Rubber Gel Back Case For Samsung Galaxy Note 5,Galaxy Note 5 Case, by Insten Clear TPU Ultra Thin Jelly Skin Rubber Gel Back Case For Samsung Galaxy Note 5,Default Category/Phones & Accessories/Cell Phone Accessories/Cell Phone Cases
2138519,Galaxy Note 5 Case, by Insten Green TPU Ultra Thin Jelly Skin Cover Case For Samsung Galaxy Note 5,Galaxy Note 5 Case, by Insten Green TPU Ultra Thin Jelly Skin Cover Case For Samsung Galaxy Note 5,Default Category/Phones & Accessories/Cell Phone Accessories/Cell Phone Cases
2139448,Galaxy Note 5 Case, by Insten Hot Pink PU Leather Wallet Flip Stand Case Cover w/ Card Slot For Samsung Galaxy Note 5,Galaxy Note 5 Case, by Insten Hot Pink PU Leather Wallet Flip Stand Case Cover w/ Card Slot For Samsung Galaxy Note 5,Default Category/Phones & Accessories/Cell Phone Accessories/Cell Phone Cases
2138511,Galaxy Note 5 Case, by Insten Hot Pink TPU Pudding Ultra Thin Rubber Skin Gel Case For Samsung Galaxy Note 5,Galaxy Note 5 Case, by Insten Hot Pink TPU Pudding Ultra Thin Rubber Skin Gel Case For Samsung Galaxy Note 5,Default Category/Phones & Accessories/Cell Phone Accessories/Cell Phone Cases
2138517,Galaxy Note 5 Case, by Insten Hot Pink TPU Slim Rubber Gel Jelly Case For Samsung Galaxy Note 5,Galaxy Note 5 Case, by Insten Hot Pink TPU Slim Rubber Gel Jelly Case For Samsung Galaxy Note 5,Default Category/Phones & Accessories/Cell Phone Accessories/Cell Phone Cases
2136148,Galaxy Note 5 Case, by Insten Hybrid Dual Layer Cover Case with stand For Samsung Galaxy Note 5 - Black,Galaxy Note 5 Case, by Insten Hybrid Dual Layer Cover Case with stand For Samsung Galaxy Note 5 - Black,Default Category/Phones & Accessories/Cell Phone Accessories/Cell Phone Cases
2136157,Galaxy Note 5 Case, by Insten Hybrid Dual Layer Cover Case with stand For Samsung Galaxy Note 5 - Black/Gray,Galaxy Note 5 Case, by Insten Hybrid Dual Layer Cover Case with stand For Samsung Galaxy Note 5 - Black/Gray,Default Category/Phones & Accessories/Cell Phone Accessories/Cell Phone Cases
2136149,Galaxy Note 5 Case, by Insten Hybrid Dual Layer Cover Case with stand For Samsung Galaxy Note 5 - Black/Red,Galaxy Note 5 Case, by Insten Hybrid Dual Layer Cover Case with stand For Samsung Galaxy Note 5 - Black/Red,Default Category/Phones & Accessories/Cell Phone Accessories/Cell Phone Cases
2136151,Galaxy Note 5 Case, by Insten Hybrid Dual Layer Cover Case with stand For Samsung Galaxy Note 5 - Blue/Black,Galaxy Note 5 Case, by Insten Hybrid Dual Layer Cover Case with stand For Samsung Galaxy Note 5 - Blue/Black,Default Category/Phones & Accessories/Cell Phone Accessories/Cell Phone Cases
2136153,Galaxy Note 5 Case, by Insten Hybrid Dual Layer Cover Case with stand For Samsung Galaxy Note 5 - Gray/Black,Galaxy Note 5 Case, by Insten Hybrid Dual Layer Cover Case with stand For Samsung Galaxy Note 5 - Gray/Black,Default Category/Phones & Accessories/Cell Phone Accessories/Cell Phone Cases
2136150,Galaxy Note 5 Case, by Insten Hybrid Dual Layer Cover Case with stand For Samsung Galaxy Note 5 - Pink/Black,Galaxy Note 5 Case, by Insten Hybrid Dual Layer Cover Case with stand For Samsung Galaxy Note 5 - Pink/Black,Default Category/Phones & Accessories/Cell Phone Accessories/Cell Phone Cases
2136152,Galaxy Note 5 Case, by Insten Hybrid Dual Layer Cover Case with stand For Samsung Galaxy Note 5 - Red/Black,Galaxy Note 5 Case, by Insten Hybrid Dual Layer Cover Case with stand For Samsung Galaxy Note 5 - Red/Black,Default Category/Phones & Accessories/Cell Phone Accessories/Cell Phone Cases
2136156,Galaxy Note 5 Case, by Insten Hybrid Dual Layer Cover Case with stand For Samsung Galaxy Note 5 - Teal/Hot Pink,Galaxy Note 5 Case, by Insten Hybrid Dual Layer Cover Case with stand For Samsung Galaxy Note 5 - Teal/Hot Pink,Default Category/Phones & Accessories/Cell Phone Accessories/Cell Phone Cases
2136155,Galaxy Note 5 Case, by Insten Hybrid Dual Layer Cover Case with stand For Samsung Galaxy Note 5 - White/Blue,Galaxy Note 5 Case, by Insten Hybrid Dual Layer Cover Case with stand For Samsung Galaxy Note 5 - White/Blue,Default Category/Phones & Accessories/Cell Phone Accessories/Cell Phone Cases
2136154,Galaxy Note 5 Case, by Insten Hybrid Dual Layer Cover Case with stand For Samsung Galaxy Note 5 - White/Purple,Galaxy Note 5 Case, by Insten Hybrid Dual Layer Cover Case with stand For Samsung Galaxy Note 5 - White/Purple,Default Category/Phones & Accessories/Cell Phone Accessories/Cell Phone Cases
2139450,Galaxy Note 5 Case, by Insten Mint Green PU Leather Wallet Flip Stand Case Cover w/ Card Slot For Samsung Galaxy Note 5,Galaxy Note 5 Case, by Insten Mint Green PU Leather Wallet Flip Stand Case Cover w/ Card Slot For Samsung Galaxy Note 5,Default Category/Phones & Accessories/Cell Phone Accessories/Cell Phone Cases
2138508,Galaxy Note 5 Case, by Insten Mint Green TPU Pudding Ultra Thin Rubber Skin Gel Case For Samsung Galaxy Note 5,Galaxy Note 5 Case, by Insten Mint Green TPU Pudding Ultra Thin Rubber Skin Gel Case For Samsung Galaxy Note 5,Default Category/Phones & Accessories/Cell Phone Accessories/Cell Phone Cases
2138515,Galaxy Note 5 Case, by Insten Mint Green TPU Slim Rubber Gel Jelly Case For Samsung Galaxy Note 5,Galaxy Note 5 Case, by Insten Mint Green TPU Slim Rubber Gel Jelly Case For Samsung Galaxy Note 5,Default Category/Phones & Accessories/Cell Phone Accessories/Cell Phone Cases
2139451,Galaxy Note 5 Case, by Insten Purple PU Leather Wallet Flip Stand Case Cover w/ Card Slot For Samsung Galaxy Note 5,Galaxy Note 5 Case, by Insten Purple PU Leather Wallet Flip Stand Case Cover w/ Card Slot For Samsung Galaxy Note 5,Default Category/Phones & Accessories/Cell Phone Accessories/Cell Phone Cases
2138509,Galaxy Note 5 Case, by Insten Purple TPU Rubber Gel Case For Samsung Galaxy Note 5,Galaxy Note 5 Case, by Insten Purple TPU Rubber Gel Case For Samsung Galaxy Note 5,Default Category/Phones & Accessories/Cell Phone Accessories/Cell Phone Cases
2138516,Galaxy Note 5 Case, by Insten Purple TPU Ultra Thin Jelly Skin Rubber Gel Back Case For Samsung Galaxy Note 5,Galaxy Note 5 Case, by Insten Purple TPU Ultra Thin Jelly Skin Rubber Gel Back Case For Samsung Galaxy Note 5,Default Category/Phones & Accessories/Cell Phone Accessories/Cell Phone Cases
2139447,Galaxy Note 5 Case, by Insten White Leather Wallet Flip Stand Case with Card Slot For Samsung Galaxy Note 5,Galaxy Note 5 Case, by Insten White Leather Wallet Flip Stand Case with Card Slot For Samsung Galaxy Note 5,Default Category/Phones & Accessories/Cell Phone Accessories/Cell Phone Cases
2138512,Galaxy Note 5 Case, by Insten White TPU Rubber Gel Case For Samsung Galaxy Note 5,Galaxy Note 5 Case, by Insten White TPU Rubber Gel Case For Samsung Galaxy Note 5,Default Category/Phones & Accessories/Cell Phone Accessories/Cell Phone Cases
2138520,Galaxy Note 5 Case, by Insten White TPU Ultra Thin Jelly Skin Cover Case For Samsung Galaxy Note 5,Galaxy Note 5 Case, by Insten White TPU Ultra Thin Jelly Skin Cover Case For Samsung Galaxy Note 5,Default Category/Phones & Accessories/Cell Phone Accessories/Cell Phone Cases
2078912,Google Nexus 6 Case, by Insten Black TPU Jelly Rubber Gel Case Cover For Motorola Google Nexus 6,Google Nexus 6 Case, by Insten Black TPU Jelly Rubber Gel Case Cover For Motorola Google Nexus 6,Default Category/Phones & Accessories/Cell Phone Accessories/Cell Phone Cases
2078869,Google Nexus 6 Case, by Insten Light Pink TPU Jelly Rubber Gel Case Cover For Motorola Google Nexus 6,Google Nexus 6 Case, by Insten Light Pink TPU Jelly Rubber Gel Case Cover For Motorola Google Nexus 6,Default Category/Phones & Accessories/Cell Phone Accessories/Cell Phone Cases
2078826,Google Nexus 6 Case, by Insten Mint Green TPU Jelly Rubber Gel Case Cover For Motorola Google Nexus 6,Google Nexus 6 Case, by Insten Mint Green TPU Jelly Rubber Gel Case Cover For Motorola Google Nexus 6,Default Category/Phones & Accessories/Cell Phone Accessories/Cell Phone Cases
2078955,Google Nexus 6 Case, by Insten Yellow TPU Jelly Rubber Gel Case Cover For Motorola Google Nexus 6,Google Nexus 6 Case, by Insten Yellow TPU Jelly Rubber Gel Case Cover For Motorola Google Nexus 6,Default Category/Phones & Accessories/Cell Phone Accessories/Cell Phone Cases
1991129,HTC Nexus 9 Case, by Insten Slim Fit Folio Leather Stand Case Cover for HTC Google Nexus 9 Tablet (8.9 inch 2014) Black,HTC Nexus 9 Case, by Insten Slim Fit Folio Leather Stand Case Cover for HTC Google Nexus 9 Tablet (8.9 inch 2014) Black,Default Category/Computers & Peripherals/Computer Accessories/Screen Privacy Covers & Protectors
2123716,Hybrid Clear LED Flash Flashing Case with Diamond for Apple iPhone 6 - Charm Paris Tower,Hybrid Clear LED Flash Flashing Case with Diamond for Apple iPhone 6 - Charm Paris Tower,Default Category/Phones & Accessories/Cell Phone Accessories/Cell Phone Cases
2123715,Hybrid Clear LED Flash Flashing Case with Diamond for Apple iPhone 6 - Charm Star,Hybrid Clear LED Flash Flashing Case with Diamond for Apple iPhone 6 - Charm Star,Default Category/Phones & Accessories/Cell Phone Accessories/Cell Phone Cases
2123714,Hybrid Clear LED Flash Flashing Case with Diamond for Apple iPhone 6 - Charm Tear Drops,Hybrid Clear LED Flash Flashing Case with Diamond for Apple iPhone 6 - Charm Tear Drops,Default Category/Phones & Accessories/Cell Phone Accessories/Cell Phone Cases
2090058,Hybrid Hard Silicone Dual Layer Case Cover with Card Slot For Samsung Galaxy S6 , Black/Gold,Hybrid Hard Silicone Dual Layer Case Cover with Card Slot For Samsung Galaxy S6 , Black/Gold,Default Category/Phones & Accessories/Cell Phone Accessories/Cell Phone Cases
2090056,Hybrid Hard Silicone Dual Layer Case Cover with Card Slot For Samsung Galaxy S6 , Black/Hot Pink,Hybrid Hard Silicone Dual Layer Case Cover with Card Slot For Samsung Galaxy S6 , Black/Hot Pink,Default Category/Phones & Accessories/Cell Phone Accessories/Cell Phone Cases
2090054,Hybrid Hard Silicone Dual Layer Case Cover with Card Slot For Samsung Galaxy S6 , Black/Navy Blue,Hybrid Hard Silicone Dual Layer Case Cover with Card Slot For Samsung Galaxy S6 , Black/Navy Blue,Default Category/Phones & Accessories/Cell Phone Accessories/Cell Phone Cases
2090057,Hybrid Hard Silicone Dual Layer Case Cover with Card Slot For Samsung Galaxy S6 , Black/Teal Green,Hybrid Hard Silicone Dual Layer Case Cover with Card Slot For Samsung Galaxy S6 , Black/Teal Green,Default Category/Phones & Accessories/Cell Phone Accessories/Cell Phone Cases
2090055,Hybrid Hard Silicone Dual Layer Case Cover with Card Slot For Samsung Galaxy S6 , Light Pink/White,Hybrid Hard Silicone Dual Layer Case Cover with Card Slot For Samsung Galaxy S6 , Light Pink/White,Default Category/Phones & Accessories/Cell Phone Accessories/Cell Phone Cases
1606142,Insten (6 Front+6 Back) Clear LCD FULL BODY Screen Protector Guard Film For Apple iPhone 5 5S,Insten (6 Front+6 Back) Clear LCD FULL BODY Screen Protector Guard Film For Apple iPhone 5 5S,Default Category/Computers & Peripherals/Computer Accessories/Screen Privacy Covers & Protectors
543051,Insten 1 / 4 Audio to 1 / 8 Audio M / F Adapter (1/4" M to 1/8" 3.5mm F),Insten 1 / 4 Audio to 1 / 8 Audio M / F Adapter (1/4" M to 1/8" 3.5mm F),Default Category/Home Audio & Theatre/Audio/Audio Components
2123614,Insten 1 FT 8PIN & Micro 2-in-1 White USB Noodle Charging Cable For iPhone 6 6+ 5 Samsung Galaxy S6 S5 Moto X E Cell Tab,Insten 1 FT 8PIN & Micro 2-in-1 White USB Noodle Charging Cable For iPhone 6 6+ 5 Samsung Galaxy S6 S5 Moto X E Cell Tab,Default Category/Computers & Peripherals/Computer Components/Cables
1900913,Insten 1 PCS Anti-Glare Matte Surface Anti Fingerprints Screen LCD Guard Protector For LG G3 D855,Insten 1 PCS Anti-Glare Matte Surface Anti Fingerprints Screen LCD Guard Protector For LG G3 D855,Default Category/Computers & Peripherals/Computer Accessories/Screen Privacy Covers & Protectors
1900914,Insten 1 PCS Ultra Clear HQ Crystal Transparent Anti Scratch Screen Guard Film Protector For LG G3 D855,Insten 1 PCS Ultra Clear HQ Crystal Transparent Anti Scratch Screen Guard Film Protector For LG G3 D855,Default Category/Computers & Peripherals/Computer Accessories/Screen Privacy Covers & Protectors
1939415,Insten 1 x Anti Glare Matte Screen Protector For iPhone 6S Plus / 6 Plus 5.5",Insten 1 x Anti Glare Matte Screen Protector For iPhone 6S Plus / 6 Plus 5.5",Default Category/Computers & Peripherals/Computer Accessories/Screen Privacy Covers & Protectors
1926068,Insten 1 x Anti-Glare Screen Protector Anti-Scratch LCD Film Guard For iPhone 6 6S 4.7 inch,Insten 1 x Anti-Glare Screen Protector Anti-Scratch LCD Film Guard For iPhone 6 6S 4.7 inch,Default Category/Computers & Peripherals/Computer Accessories/Screen Privacy Covers & Protectors
587355,Insten 1 X Clear LCD Screen Protector for Metro PCS Samsung Galaxy Attain 4G R920,Insten 1 X Clear LCD Screen Protector for Metro PCS Samsung Galaxy Attain 4G R920,Default Category/Computers & Peripherals/Computer Accessories/Screen Privacy Covers & Protectors
1926067,Insten 1 x Clear Screen Protector Guard For iphone 6S 6,Insten 1 x Clear Screen Protector Guard For iphone 6S 6,Default Category/Computers & Peripherals/Computer Accessories/Screen Privacy Covers & Protectors
1939414,Insten 1 x Clear Screen Protector LCD Guard Shield For iPhone 6 Plus 6S Plus 5.5" 5.5 Inches,Insten 1 x Clear Screen Protector LCD Guard Shield For iPhone 6 Plus 6S Plus 5.5" 5.5 Inches,Default Category/Computers & Peripherals/Computer Accessories/Screen Privacy Covers & Protectors
1926071,Insten 1 x Colorful Diamond Screen Protector LCD Film Anti-Scratch Guard For iphone 6S 6,Insten 1 x Colorful Diamond Screen Protector LCD Film Anti-Scratch Guard For iphone 6S 6,Default Category/Computers & Peripherals/Computer Accessories/Screen Privacy Covers & Protectors
1939418,Insten 1 x Colorful Diamond Screen Protector LCD Film For iPhone 6S Plus / 6 Plus 5.5",Insten 1 x Colorful Diamond Screen Protector LCD Film For iPhone 6S Plus / 6 Plus 5.5",Default Category/Computers & Peripherals/Computer Accessories/Screen Privacy Covers & Protectors
1926069,Insten 1 x Mirror Screen Protector Anti-Scratch LCD Film Guard For iPhone 6 6S 4.7 inch,Insten 1 x Mirror Screen Protector Anti-Scratch LCD Film Guard For iPhone 6 6S 4.7 inch,Default Category/Computers & Peripherals/Computer Accessories/Screen Privacy Covers & Protectors
1939416,Insten 1 x Mirror Screen Protector Guard For iPhone 6S Plus / 6 Plus 5.5",Insten 1 x Mirror Screen Protector Guard For iPhone 6S Plus / 6 Plus 5.5",Default Category/Computers & Peripherals/Computer Accessories/Screen Privacy Covers & Protectors
1975556,Insten 1 x Mirror Screen Protector LCD Guard Film For Samsung Galaxy Note 4 IV N9100,Insten 1 x Mirror Screen Protector LCD Guard Film For Samsung Galaxy Note 4 IV N9100,Default Category/Computers & Peripherals/Computer Accessories/Screen Privacy Covers & Protectors
1926066,Insten 1 x Premium Tempered Glass Screen Protector LCD Film Guard For iPhone 6 6S 4.7 inch,Insten 1 x Premium Tempered Glass Screen Protector LCD Film Guard For iPhone 6 6S 4.7 inch,Default Category/Computers & Peripherals/Computer Accessories/Screen Privacy Covers & Protectors
